,Name,Case Number,City,States & Territories,Date Filed,Region Assigned,Status,Date Closed,Reason Closed,No. of Eligible Voters,No. of Employees,Certified Representative,Unit Sought
9348,"CoreCivic of Tennessee, LLC d/b/a Central Arizona Florence Correctional Center",28-RC-288330,Florence,AZ,2021-12-30,"Region 28, Phoenix, Arizona",Closed,03/31/2022,Certific. of Representative,17.0,17.0,"United Association of Plumbers and Pipefitters, Local 469","Included: All full-time and regular part-time maintenance employees including apprentices and helpers employed by the Employer at the Central Arizona Florence Correctional Center.

Excluded: All other employees, office clerical employees, managers, guards, and supervisors as defined in the Act at the is Central Arizona Florence Correctional Center."
9351,Starbucks Corporation,27-RC-288318,Louisville,CO,2021-12-30,"Region 27, Denver, Colorado",Closed,05/23/2022,Certific. of Representative,30.0,24.0,"Chicago and Midwest Regional Joint Board, Workers United / SEIU","Include: All full-time and part-time Baristas and Shift Supervisors. Exclude: Store Mangers, office clericals, guards, professional employees, and supervisors."
9352,"Central Network Retail Group, LLC d/b/a Frattallone's Hardware and Garden",18-RC-288324,Circle Pines,MN,2021-12-30,"Region 18, Minneapolis, Minnesota",Closed,02/01/2022,Withdrawal Non-adjusted,,15.0,,"Included:  Full-time and part-time cashiers, sales associates, window shop techs and closers.

Excluded:  Store Mgr, guards, professional employees, and supervisors as defined by the Act."
9353,"Riverstreet Center Opco, LLC",04-RC-288206,Wilkes-Barre,PA,2021-12-29,"Region 04, Philadelphia, Pennsylvania",Closed,03/17/2022,Certific. of Representative,17.0,18.0,"Retail, Wholesale, Department Store Union/United Food Commercial Workers (RWDSU/UFCW)","Included:  All full time, part time and PRN License Practice Nurses

Excluded:  All supervisors and management positions define by the Act"
9355,C&W Facility Services Inc.,01-RC-288234,Marlborough,MA,2021-12-29,"Region 01, Boston, Massachusetts",Closed,02/25/2022,Certific. of Representative,5.0,5.0,International Union of Operating Engineers Local 877 & Local 4,"Included:  All full-time, regular part-time, and per diem skilled trades employees including Electricians, Painters, Carpenters, Plumbers, Maintenance Mechanics, Licensed Engineers, Licensed Firemen, HVAC Mechanics, working foremen, Chiefs and Leads.  Excluded:  All clerical/administrative, managers, confidential employees, and guards and professional employees and supervisors as defined in the Act."
9356,Colgate Heating Corporation,03-RC-288246,Buffalo,NY,2021-12-29,"Region 03, Buffalo, New York",Closed,03/03/2022,Certification of Results,10.0,12.0,,"All full-time and regular part-time employees including welders, fabricators, feild tech's etc at the Employer's facility in Buffalo, NY

Excluded:  All temporary employees, office clerical and professional employees, guards, foreman, salaried employees, and supervisors as defined in the Act"
9357,"Alliance for a Healthier Generation, Inc.",19-RC-288289,Portland,OR,2021-12-29,"Region 19, Seattle, Washington",Closed,03/24/2022,Certification of Results,53.0,44.0,,"Included: All Associate Director, Associate Director/Cause Marketing and Communications, Family Engagement Manager, National Content Advisor, Rise Program Manager, Content Manager, Social and Emotional Health, Member Engagement and Support Manager, Social Emotional Health Content Manager, Data Manager, HSCP Manager, Network, Healthy Schools Program Manager, Senior Manager Digital Marketing, Business Systems Analyst, Member Engagement and Support Manager Communications, Regional Program Manager, Software and Data Engineer, Software Development Manager, Rise Virtual Program Manager, National Advisor, HSCP, Senior Managment Development, Digital Engagement Specialist, Senior National PE/PA Advisor, Digital Marketing Manager, UX/UI Designer, Technical Support Specialist, Virtual Content Manager/Social Emotional Health. Excluded: Guards and Supervisors as defined by the Act."
9358,Community Work Training Association,19-RC-288296,Bellingham,WA,2021-12-29,"Region 19, Seattle, Washington",Closed,03/04/2022,Certific. of Representative,17.0,14.0,"General Teamsters Union Local No. 231, affiliated with the International Brotherhood of Teamsters","Included: All regular full time, part time, and cover staff. Excluded: Director and Assistant Director"
9359,"SHoP Architects, Inc.",02-RC-288187,New York,NY,2021-12-28,"Region 02, New York, New York",Closed,02/03/2022,Withdrawal Non-adjusted,,91.0,,"Included: all full-time and regular part-time employees in the following job classifications:
Associate Principals
Associates
Associates, Interactive Visualization
Senior Associates
Department Directors
Project Directors
Designers
IT Support Assistance
Senior Systems Engineer
Senior Design Team Coordinator

Excluded: all Principals, Managers, Supervisors, Confidential Employees, Temporary and
Student Employees, and Guards"
9360,Abbott Northwestern Hospital,18-RC-288243,Minneapolis,MN,2021-12-28,"Region 18, Minneapolis, Minnesota",Closed,02/15/2022,Certification of Results,112.0,111.0,SEIU Healthcare Minnesota,"Included:  All full-time and regular part time physical therapists, occupational therapists and speech therapists in the acute care, cardiac rehabilitation, in-patient rehabilitation, outpatient rehabilitation, and resource units to be added to the existing professional employees unit via Armour-Globe.

Excluded:  All other professional employees, service and maintenance employees, technical employees, business office clerical employees, registered nurses, skilled maintenance employees, physicians, managers, supervisors, and guards."
9362,"Providence Health & Services - Western Washington, d/b/a Providence Regional Medical Center Everett",19-RC-288202,Everett,WA,2021-12-28,"Region 19, Seattle, Washington",Closed,03/04/2022,Certification of Results,4.0,4.0,"United Food and Commercial Workers Local 21, affiliated with United Food and Commercial Workers International Union","Included: The petitioner seeks to add through an Armour-Globe self-determination election all full time, part time, and per diem Dieticians employed by the employer at Providence Regional Medical Center-Everett Pacific Campus (916 Pacific Avenue Everett WA 98201), Providence Regional Medical Center Everett Pavilion for Women & Children (900 Pacific Avenue Everett WA 98201), and Providence Regional Cancer Partnership (1717 13th street Everett WA 98201) to the existing Professional bargaining unit. Excluded: Excluding all guards, supervisors, managers, and confidential employees as defined by the Act."
9363,"Prospect Chartercare RWMC, LLC",01-RC-288207,Providence,RI,2021-12-28,"Region 01, Boston, Massachusetts",Closed,03/09/2022,Certific. of Representative,214.0,220.0,United Nurses and Allied Professionals,"Included: All full time and regular part time registered nurses employed by Rogers Williams Medical.
Excluded: All other employees, guards and supervisors as defined by the Act."
9365,Starbucks Corporation,10-RC-288098,Knoxville,TN,2021-12-27,"Region 10, Atlanta, Georgia",Closed,04/05/2022,Certific. of Representative,27.0,28.0,"Workers United Labor Union International, affiliated with Service Employees International Union","Included:  All full-time and regular part-time Baristas, Shift Supervisors, Asst. Store Managers. 
Excluded:  Store Managers, office clericals, guards, and supervisors as defined by the Act."
9366,"BFI Waste Services, LLC d/b/a Republic Services of Georgia",10-RC-288115,Winder,GA,2021-12-27,"Region 10, Atlanta, Georgia",Closed,03/08/2022,Certification of Results,155.0,140.0,,"Included:  All FT & reg PT roll-off, front load, swing, residential, recycle, and container delivery drivers and helpers.

Excluded:  All other employees, including temporary employees, mechanics, office clerical employees, guards, and supervisors as defined in the Act."
9367,"PharmaCann, Inc.",13-RC-288158,Schaumburg,IL,2021-12-27,"Region 13, Chicago, Illinois",Closed,03/08/2022,Certific. of Representative,19.0,16.0,Teamsters Local Union No. 777,"Included: Cannabis Support Center Specialists Excluded: All trainers, supervisors, guards, and managerial employees as defined by the Act"
9369,"Northern States Power Company, a Minnesota corporation, d/b/a Xcel Energy",18-RC-288180,Minneapolis,MN,2021-12-27,"Region 18, Minneapolis, Minnesota",Closed,04/20/2022,Certification of Results,19.0,17.0,,"Included: All full-time and part-time BAOs, TSOs and NRLs based at the 414 Nicollet Office.

Excluded: Supervisory, managerial and confidential employees and guards as defined by the act."
9370,"Durham School Services, L.P.",25-RC-288184,Bettendorf,IA,2021-12-27,"Region 25, Indianapolis, Indiana",Closed,03/07/2022,Certific. of Representative,2.0,2.0,Teamsters Local Union 371,"Included: Mechanics

Excluded: Supervisors, Management"
9372,"Crawford Electric Cooperative, Inc.",14-RC-288089,Bourbon,MO,2021-12-23,"Region 14, Saint Louis, Missouri",Closed,03/01/2022,Certific. of Representative,,6.0,,"All full-time and regular part-time staking technicians, mapping technicians, and engineering support assistants employed at the Employer's facility at 10301 North Service Road West, Bourbon, MO to  be added to the existing unit of employees at the facility represented by the International Brotherhood of Electrical Workers, Local No. 2"
9373,"Stella-Jones, Inc.",19-RC-288111,Arlington,WA,2021-12-23,"Region 19, Seattle, Washington",Closed,01/06/2022,Withdrawal Non-adjusted,,14.0,,"Included: All full time and regular part time framer, operator, laborer, quality control, engineer, maintenance, millwright and leads working at the Arlington location. Excluded: As defined in the Act."
9374,"Riverstreet Center Opco, LLC",04-RC-288059,Wilkes-Barre,PA,2021-12-22,"Region 04, Philadelphia, Pennsylvania",Closed,03/17/2022,Certific. of Representative,38.0,36.0,"Retail, Wholesale, Department Store Union/United Food Commercial Workers (RWDSU/UFCW)","Included:  All part time and full time certified nurses aids

Excluded:  All RN nurses, LPN nurses and housekeeping employees"
9375,"Laz Parking New York/New Jersey, LLC",02-RC-288002,Peekskill,NY,2021-12-22,"Region 02, New York, New York",Closed,03/18/2022,Certification of Results,5.0,6.0,"Local 272, International Brotherhood of Teamsters","Included: All workers assigned to maintaining the employer's parking facilities from the stated location. 

Excluded: All supervisory and management personnel as defined by the Act"
9376,Guthrie Theater Foundation,18-RC-288018,Minneapolis,MN,2021-12-22,"Region 18, Minneapolis, Minnesota",Closed,03/01/2022,Certific. of Representative,10.0,15.0,"United Scenic Artists, Local USA 829, IATSE","All full-time and regular part-time scenic art employees employed by the Employer; excluding all other employees, including all clerical employees, managers, guards, and supervisors as defined by the Act."
9377,CSI Sands (N.E.) Ltd,03-RC-288015,Buffalo,NY,2021-12-22,"Region 03, Buffalo, New York",Closed,02/11/2022,Certific. of Representative,15.0,14.0,"International Union of Operating Engineers, Local 17","Laborers; operators-incl load out & control rooms; maintenance & repair workers; shift leads.  Excluded:  Professional employees, clerical staff, truck drivers."
9378,"The Public Interest Network, Operating as Integrated Enterprise",27-RC-288050,Denver,CO,2021-12-22,"Region 27, Denver, Colorado",Closed,01/28/2022,Withdrawal Non-adjusted,,208.0,,"Included: Administrative Assistant, Direct Mail, Administrative Assistant, Legal Department, Administrator, Assistant Fiscal, Administrator, Canvass Regional, Administrator, Data, Administrator, Digital Campaigns, Administrator, Digital Data Administrator, Donor Operations, Administrator, Finance, Administrator, Fiscal, Administrator, Grants Department, Administrator, IT, Administrator, National Program, Administrator, Payroll, Administrator, Recruitment, Administrator, Regional Canvass, Administrator, State Financial, Administrator, State Offices Advocate, Environment North Carolina, Advocate, Health Care Advocate, PennPIRG, Advocate, Shareholder, Advocate, WashPIRG, Assistant Canvass Director, Assistant Director, Portland Telephone Outreach Project Assistant Director, Telephone Outreach Project, Assistant to the Director of Development, Associate, Associate Director, Direct Mail, Associate, Donor Associate, 100% Renewable States, Associate, Budget Operations, Associate, CALPIRG, Associate, Clean Energy, Associate, Clean Water, Associate, Clean Water, Environment Georgia, Associate, Climate Campaign, Associate, Communications, Associate, Community Defense, Associate, Conservation Associate, Consumer Watchdog, Associate, Creative, Associate, Development Associate, Environment Illinois, Associate, Environment New Jersey, Associate, Environment Texas, Associate, Federal Legislative, Associate, Finance and Operations, Associate, Financial, Associate, Global Warming, Associate, Global Warming Solutions, Associate, Green Century, Associate, Illinois PIRG, Associate, Make It Toxic Free, Associate, Make Polluters Pay, Associate, Marketing, Associate, MarylandPIRG, Associate, MASSPIRG, Associate, Oceans, Associate, PennEnvironment, Associate, PIRG Climate, Associate, Public Health, Associate, Save the Bees, Associate, Transportation, Bookkeeper, Boston Office Manager, Campaign Associate, Campaign Director, Right to Repair, Campaign Organizer, Campaigns Associate, Public Health, Campus Clubs Organizer, Campus Organizer, Canvass Director, Community Organizer, MA and RI, Compliance Officer, Content Creator, Coordinator, Clean Water Network, Coordinator, Member Relations, Coordinator, Operations, Coordinator, Planned Giving, Data Analyst, Deputy Director of Media Relations, Deputy Editor, Deputy Political Director, Digital Campaigner, Digital Engineer, Digital Organizer, Director, Campaign to Defend the Consumer Bureau, Director, Prospecting, Director, Targeting, Field Organizer, PennEnvironment, Grantwriter, Office Administrator, Pennsylvania State, Organizer, Alumni, Organizer, Ann Arbor, Organizer, Campus Clubs, Organizer, Maine, Organizer, Web, Policy Advocate, Policy Analyst, Policy Associate, Policy Associate, Frontier Group, Projects Manager, Prospect Researcher, Recruitment Director, Senior Director, Federal Consumer Program, Senior Web Strategist, Shareholder Advocate, State Director, States Bookkeeper, Vice President, and Federal Government Affairs. 
Exclude: Callers and Administrative working in the Telephone Outreach Project office in Portland, Oregon, temporary employees, professional employees, confidential employees, managers, guards, and supervisors, as defined by the Act.
"
9380,The Coffee Tree Roasters Corporation,06-RC-288069,West Mifflin,PA,2021-12-22,"Region 06, Pittsburgh, Pennsylvania",Closed,03/02/2022,Certific. of Representative,27.0,52.0,United Food and Commercial Workers International Union,"Included: All full-time and regular part-time Baristas and Barista Pluses employed by the Employer at its retail locations at Fox Chapel Plaza, Pittsburgh, PA 15238, 299 Beverly Road, Pittsburgh, PA 15216, 10 Old Clairton Road, Pittsburgh, PA 15236, 5524 Walnut Street, Pittsburgh, PA 15232, and 5840 Forbes Avenue, Pittsburgh, PA 15217 
Excluded: All Managers, Assistant Managers, and guards, and professional employees and supervisors as defined by the National Labor Relations Act
"
9381,Amazon.com Services LLC,29-RC-288020,Staten Island,NY,2021-12-22,"Region 29, Brooklyn, New York",Open,,,8325.0,5000.0,Amazon Labor Union,
9382,Lockheed Martin Rotary and Missions Systems Training and Logistics Solutions,21-RC-288048,San Diego,CA,2021-12-22,"Region 21, Los Angeles, California",Closed,02/22/2022,Certific. of Representative,7.0,7.0,"International Association of Machinists & Aerospace Workers, District Lodge 725, AFL-CIO","Included: All full time, regular part time, and casual employees of Lockheed Marin F-35 Flight Instructors at Marine Corps Air Station Miramar

Excluded: Guards, Office Clerical and Supervisors as defined in the Act."
9383,"Ozinga Ready Mix Concrete, Inc.",13-RC-287936,Gary,IN,2021-12-21,"Region 13, Chicago, Illinois",Closed,04/05/2022,Certific. of Representative,8.0,8.0,,"Included:  All full-time and regular part-time Plant Manager, Assistant Plant Manager, and Utility Employees who work out of or report to the following facilities, 2555 E. 15th Avenue, Gary, IN 46402; 1211 E. Summit St., Crown Point, IN 46307; 10501 W. 133rd, Cedar Lake, IN 46303; 2750 Raystone Dr., Valparaiso, IN 46485; 7420 Industrial Blvd., Chesterton, IN 46304.

Excluded:  All managers, Office Clerical employees, professional employees, temporary employees, guards and supervisors as defined in the Act, and all other employees.
"
9384,"Tropical Shipping USA, LLC",12-RC-287944,Riviera Beach,FL,2021-12-21,"Region 12, Tampa, Florida",Closed,05/17/2022,Certification of Results,83.0,60.0,,Included:  All shipside employees in stevedoring department.  Excluded:  All other employees.
9385,"Verano Holdings, LLC d/b/a Zen Leaf",13-RC-287943,Lombard,IL,2021-12-21,"Region 13, Chicago, Illinois",Closed,03/08/2022,Certific. of Representative,25.0,19.0,Teamsters Local Union No. 777,"Included: Cannabis Advisors Excluded: Managers, Assistant Managers, Agents-in-charge, and all other supervisors and guards as defined by the Act"
9386,Northwest EMS,06-RC-288025,McKees Rocks,PA,2021-12-21,"Region 06, Pittsburgh, Pennsylvania",Closed,01/05/2022,Withdrawal Non-adjusted,,63.0,,"Included: All full-time and part-time Paramedics and EMT's Excluded: All office, guards, professional employees and supervisors as defined by the Act."
9387,Lines for Life,19-RC-288045,Portland,OR,2021-12-21,"Region 19, Seattle, Washington",Closed,03/03/2022,Certific. of Representative,164.0,150.0,Oregon AFSCME Council 75,"Included: All non-supervisory employees including, but not limited to the following classifications or job titles:  Lead Content Writer, CCL Preceptor, Helpers Helping Helpers Facilitator, Youth Line Outreach Coordinator, Youth Line Volunteer Coordinator, Events Specialist, Events Coordinator, OPR Coordinator, CADC Case Manager, CIS, Youth Line Staff, Youth Line Supervisor, all non-supervisory Counselors, all Team Leads, Safe and Strong Counselor, QA Specialists, non-supervisory CADCs, Coordinators, Event Specialist, all non-supervisory admin staff, all other non-supervsory staff.  Excluded: Supervisory staff,  managers, and directors."
9388,Cintas Corporation,07-RC-288086,Midland,MI,2021-12-21,"Region 07, Detroit, Michigan",Closed,01/13/2022,Withdrawal Non-adjusted,,3.0,,"Included:  Loader/Unloader (411)

Excluded:  Supervisors, Managers, General Manager and all other inside plant employees"
9389,Titmouse Inc. Animation Studios,02-RC-287902,Manhattan,NY,2021-12-20,"Region 02, New York, New York",Closed,12/29/2021,Withdrawal Non-adjusted,,100.0,,"Included:  3D Modelers,Animation Directors,Animators,Art Directors
Assistant Directors
Background Layout Artists Background Painters
Character Designer Assistants Character Designers
Character Layout Artist
Colorists
Compositors
Design Coordinator Directors Interns
Lead Storyboard Revisionist
Pro Designers
Production Assistants
Production Coordinators
Production Manager
Prop Designers
Retake Animation Directors
Retakes Animators
Rigging 
Sheet Timers
Storyboard Artists
Storyboard Checkers
Storyboard Coordinator Storyboard Directors Storyboard Revisionists Storyboard Supervisors Storybook Designers Supervising Directors Technical Directors 
Excluded:  All other employees"
9390,"Universal Protection Service, LLC d/b/a Allied Universal Security Services",05-RC-287927,Washington,DC,2021-12-20,"Region 05, Baltimore, Maryland",Closed,02/23/2022,Certific. of Representative,14.0,15.0,National League of Justice and Security Professionals (NLJSP),"Included: All regular part-time and full-time Security employees of the Employer.

Excluded: All managerial, clerical and Supervisory personnel as defined by the NLRA."
9392,Oshman Family Jewish Community Center,32-RC-287975,East Palo Alto,CA,2021-12-20,"Region 32, Oakland, California",Closed,03/18/2022,Certification of Results,6.0,5.0,,"Included:  All full-time and regular part-time audio Visual Event Technicians employed by the 
Employer  at or from its facility located at 3921 Fabian Way, Palo Alto, CA.  

Excluded: Confidential employees, office clerical employees, guards, and supervisors as defined by the Act.
"
9393,Starbucks Corporation,19-RC-287954,Seattle,WA,2021-12-20,"Region 19, Seattle, Washington",Closed,03/30/2022,Certific. of Representative,13.0,15.0,Workers United Affiliated with Service Employees International Union,"Included: All full-time and regular part-time Baristas, Shift Supervisors, Asst. Store Managers. Excluded: Store Managers; office clericals, guards, and supervisors as defined by the Act."
9395,Virginia Electric and Power Company,05-RC-287851,Surry,VA,2021-12-17,"Region 05, Baltimore, Maryland",Closed,04/06/2023,Withdrawal Non-adjusted,140.0,130.0,,"Included: All Nuclear Security Officers, Nuclear Security Specialists and Nuclear Security & Alarm Specialists.


Excluded:  All other employees and supervisors as defined by the Act."
9400,Rhode Island School of Design,01-RC-287879,Providence,RI,2021-12-17,"Region 01, Boston, Massachusetts",Closed,02/23/2022,Certific. of Representative,61.0,67.0,International Brotherhood of Teamsters Local 251,"Included: All full-time and part-time custodians, facilities (including grounds/caretakers and movers and group leaders employed by RI School of Design at its 2 college Street, Providence, RI campus. Excluded; All other employees, guards, managers and supervisors as defined in the Act."
9402,Alliance for South Sound Health dba Wellfound Behavioral Health Hospital,19-RC-287844,Tacoma,WA,2021-12-16,"Region 19, Seattle, Washington",Closed,03/04/2022,Certification of Results,39.0,55.0,Service Employees International Union Healthcare 1199NW,"Included: ARNP, Care Coordinator, Court Coordinator, Group Therapist, Group Therapy Team Lead, Licensed Mental Health Counselor, Medical NP, Mental Health Counselor, PAC, Recreational Therapist, Social Worker, Social Worker Certified, Tele Psych PMHNP, Therapy Team Lead. Excluded: All other employees, guards, and supervisors as defined by the Act."
9403,"Valiant Global Defense Services, Inc. d/b/a Valiant Integrated Services",12-RC-287831,Jacksonville,FL,2021-12-16,"Region 12, Tampa, Florida",Closed,02/24/2022,Certific. of Representative,7.0,11.0,Association of Diversified Aircrew Readiness Training Support AAAT Contract Instructors of Florida,"Included: All full-time and regular part-time electronic warfare operator contract instructors, acoustic warfare operator contract instructors, and curriculum developers employed by the Employers at the Jacksonville Naval Air Station in Jacksonville, Florida and the Naval Air Station Mayport, Florida. 

Excluded: All other employees, office clerical employees, professional employees, managerial employees, guards, and supervisors as defined by the Act. 
"
9404,"Alta Construction Equipment Illinois, LLC",13-RC-287724,Gary,IN,2021-12-15,"Region 13, Chicago, Illinois",Closed,03/03/2022,Certific. of Representative,13.0,11.0,"International Union of Operating Engineers, Local 150, AFL-CIO","Included: All regular full- and part-time parts employees employed by the Employer at
its Gary, Indiana; Spring Grove and Ottawa, Illinois, locations.

Excluded:
Guards, 
clericals, supervisors, and managers, as defined by the Act."
9405,"Pacific Parking, LLC",29-RC-287787,Brooklyn,NY,2021-12-15,"Region 29, Brooklyn, New York",Closed,04/27/2022,Certific. of Representative,6.0,3.0,"Local 272, International Brotherhood of Teamsters",Included: 3 Excluded: 0
9406,"Linxx Global Solutions, Inc.",05-RC-287700,Quantico,VA,2021-12-15,"Region 05, Baltimore, Maryland",Closed,02/03/2022,Certific. of Representative,10.0,10.0,Federal Contract Guards of America (FCGOA),"Included: All full-time and regular part-time protective security officers working for the Company on its subcontract with the Federal Government at the DEA Quantico Training Academy.


Excluded:  All other employees, including administrative, clerical, and non-guards, as defined by the NLRA, as amended."
9407,"Ray S.F. Inc., d/b/a FreezPak Logistics",04-RC-287758,Philadelphia,PA,2021-12-15,"Region 04, Philadelphia, Pennsylvania",Closed,03/02/2022,Certification of Results,9.0,9.0,,"Included:  All full-time and regular part-time warehouse employees employed by the Employer at its 1801 North 5th Street, Philadelphia, PA facility. 

Excluded:  All other employees, temporary employees, clerical employees, managers, guards and supervisors as defined in the Act."
9408,Cushman & Wakefield,06-RC-287721,Pittsburgh,PA,2021-12-15,"Region 06, Pittsburgh, Pennsylvania",Closed,12/17/2021,Withdrawal Non-adjusted,,2.0,,"Included: All full time and part time skilled maintenance staff. Excluded: Office clerical employees, security guards and professional employees."
9409,Preterm,08-RC-287769,Cleveland,OH,2021-12-15,"Region 08, Cleveland, Ohio",Closed,01/07/2022,Withdrawal Non-adjusted,,50.0,,"Included:  Administrative Assistant, Appointment Center Manager, Clinic Administrative Supervisor, Digital Community Organizing Specialist, Intake Medical Receptionist, Medical Associate, Medical Records Manager, Medical Support, Patient Advocate, Policy and Partnership Associate, Patient Advocate, Preterm Associate, Preterm Facilities, Preterm Financial Manager, Preterm Intake, Quality and Compliance Manager, Registered Nurse, Ultera Sound Technician,

Excluded: All other employees, managers, guards and supervisors as defined by the Act."
