10649,"Freight Management Group, Inc. t/a FSI",22-RC-275549,Elizabeth,NJ,2021-04-14,"Region 22, Newark, New Jersey",Closed,07/30/2021,Certification of Results,42.0,43.0,,"Included: Loaders.

Excluded: Any and all other employees Including supervisors."
10650,The Latin School of Chicago,13-RC-275580,Chicago,IL,2021-04-14,"Region 13, Chicago, Illinois",Closed,06/10/2021,Certific. of Representative,181.0,185.0,"Illinois Federation of Teachers, Local #6612 (Association of International Comedy Educators)","Teachers, assistant teachers, department chairs, academic chairs, deans, librarians, nurses,
counselors, and assistant directors of college counseling
"
10654,Havenwyck Hospital,07-RC-275571,Auburn Hills,MI,2021-04-13,"Region 07, Detroit, Michigan",Closed,05/14/2021,Withdrawal Non-adjusted,,100.0,,"Included:  Psychiatric Care Specialist

Excluded: All Other Classification"
10655,Suiza Dairy Corporation,12-RC-275706,Ponce,PR,2021-04-13,"Region 12, Tampa, Florida",Closed,06/22/2021,Certific. of Representative,12.0,13.0,Central General De Trabajadores,Included:  All regular full time and part time employees employed by the Employer at Ponce Facilities as defined by 24-RC-061098
10656,All Creatures Animal Hospital,19-RC-275600,Bremerton,WA,2021-04-13,"Region 19, Seattle, Washington",Closed,06/23/2021,Certific. of Representative,37.0,32.0,National Veterinary Professionals Union,"Included: 

All full time and regular part-time employees, including Licensed Veterinary Technicians, Assistants, Receptionists, Hospital Attendants, and Facilities Managers employed by the Employer at its Bremerton, Washington location.

Excluded: 

Doctors, managers, guards, supervisors as defined by the Act, confidential employees, and office clerical employees."
10657,"S.E.A.L. Security, LLC",22-RC-275462,Dayton,NJ,2021-04-12,"Region 22, Newark, New Jersey",Closed,05/05/2021,Withdrawal Non-adjusted,,10.0,,"Included:  All Security Guard Lead Personnel.

Excluded:

All other Employees"
10658,"Imperial Crane Services, Inc.",13-RC-275444,Bridgeview,IL,2021-04-12,"Region 13, Chicago, Illinois",Closed,04/29/2021,Withdrawal Non-adjusted,,56.0,,"Included:
All full-time and regular part-time Craft Foreman, Operators, Oilers, Technicians, Riggers, Field
Mechanics, Shop Mechanics, Apprentices, Parts Runners/Drivers, CDL Drivers, Non-CDL
Drivers, and Yardmen employed at the Employer’s facilities in Local 150’s Jurisdiction.

Excluded:
Office and clerical employees, professional employees, sales representatives, guards and
supervisors as defined under the Act."
10659,"CRRC Times Electric USA, LLC",21-RC-275447,City Of Industry,CA,2021-04-12,"Region 21, Los Angeles, California",Closed,06/11/2021,Certific. of Representative,2.0,2.0,International Brotherhood of Electrical Workers Local 11,"Included: Full-time and regular part-time production technicians

Excluded: Office clericals, managerials, professionals, guards and supervisors"
10661,Komatsu America Corp.,03-RC-275411,Pine Bush,NY,2021-04-12,"Region 03, Buffalo, New York",Closed,04/30/2021,Withdrawal Non-adjusted,,9.0,,"Included: All full time and part time mechanics working at Employer's Pine Bush location Excluded: all other employees, including office clerical employees, managerial employees, guards, and supervisors defined by the Act"
10662,"First Transit, Inc.",05-RC-275433,Glen Burnie,MD,2021-04-12,"Region 05, Baltimore, Maryland",Closed,06/10/2021,Certific. of Representative,47.0,55.0,Amalgamated Transit Union Local 1764 a/w Amalgamated Transit Union AFL-CIO/CLC,"Included:  All full-time and regular part-time bus operators employed at or out of First Transit's facility in Glen Burnie, Maryland.

Excluded:  All other employees, guards, and supervisors under the Act."
10664,Worcester Natural History Society,01-RC-275490,Worcester,MA,2021-04-12,"Region 01, Boston, Massachusetts",Closed,07/15/2021,Certific. of Representative,22.0,19.0,"American Federation of State, County and Municipal Employees, Council 93, AFL-CIO",
10665,111 West 57th Street Condominium,02-RC-275464,New York,NY,2021-04-12,"Region 02, New York, New York",Closed,04/26/2021,Withdrawal Non-adjusted,,11.0,,"Included:
All building service workers

Excluded:
Statutory guards and supervisors"
10667,"Energy Choice California, LLC",21-RC-275466,Baldwin Park,CA,2021-04-12,"Region 21, Los Angeles, California",Closed,04/28/2021,Withdrawal Non-adjusted,,24.0,,"Included: All full-time and regular part-time hourly call center Customer Service Representatives and Shift Leaders employed by the Employer at its CCA call center facility located at 4900 Rivergrade Rd. Suite D210, Irwindale, California who are scheduled for 1250 service hours or more in a calendar year.

Excluded: All other employees, including employees not employed by the Employer, professional employees, confidential employees, casual employees, technical employees, office clerical employees, managers, guards, and supervised as defined by the Act."
10668,Lifelong Medical Care,32-RC-275467,Berkeley,CA,2021-04-12,"Region 32, Oakland, California",Closed,08/09/2021,Certific. of Representative,132.0,135.0,"Union of American Physicians & Dentists a/w AFSCME, AFL-CIO","Included: All Internal Medicine, Family Medicine, Psychiatric, and Primary Care Physicians, LCSWs, Nurse Practitioners, Family Nurse Practitioners, Psych. Nurse Practitioners, Physician Assistants, Certified Nurse Mid Wives, Chiropractors, Acupuncturists, and Doctors of Dental Science employed at the following locations: LIFELONG MEDICAL CARE, 9933 Mac Arthur Blvd, Oakland, CA 94605;  LIFELONG EAST OAKLAND HEALTH CENTER, 10700 MacArthur Blvd, Oakland, CA 94605; LIFELONG MEDICAL CARE ADMINISTRATIVE OFFICES, 2344 Sixth Street, Berkeley, CA 94710; LIFELONG WEST BERKELEY HEALTH CENTER, 837 Addison Street, Berkeley, CA 94710; LIFELONG MEDICAL CARE, 2600 MacDonald Ave, Richmond, CA 94804; LIFELONG OVER 60 HEALTH CENTER, 3260 Sacramento Street, Berkeley CA 94702; LIFELONG BROOKSIDE SAN PABLO, 2023 Vale Road, San Pablo, CA 94806; LIFELONG RODEO HEALTH CENTER, 25 California Street, Rodeo, CA 94572; LIFELONG ASHBY HEALTH CENTER, 3075 Adeline Street # 280, Berkeley, CA 94703; LIFELONG PINOLE HEALTH CENTER, 806 San Pablo Ave., Ste 1, Pinole, CA 94564; LIFELONG TRUST HEALTH CENTER, 386 14th Street, Oakland, CA 94612; LIFELONG DENTAL CARE, 1860 Alcatraz Ave., Berkeley, CA 94703; LIFELONG WILLIAM JENKINS HEALTH CENTER, 150 Harbour Way, Ste 200, Richmond, CA 94801; LIFELONG EMERYVILLE SCHOOL BASED HEALTH CENTER, 4727 San Pablo Ave., b214, Emeryville, CA 94608; LIFELONG HOWARD DANIEL, 9933 MacArthur Blvd, Oakland, CA 94605; and, LIFELONG DOWNTOWN OAKLAND HEALTH CENTER, 616 16th Street, Oakland, CA 94612.

Excluded: All other employees, guards, office clerical and supervisors."
10670,"Prospect CCMC, LLC, d/b/a Delaware County Memorial Hospital",04-RC-275405,Drexel Hill,PA,2021-04-09,"Region 04, Philadelphia, Pennsylvania",Closed,06/28/2021,Certific. of Representative,15.0,30.0,Pennsylvania Association of Staff Nurses and Allied Professionals/Temple Allied Professionals,"Included: All full-time, part-time, and per diem Registered Dietitians, Physical Therapists, Occupational Therapists, Speech Therapists, and Social Workers.

Excluded: All other technical employees, registered nurses, physicians, service and maintenance, skilled maintenance, guards, business clerical, confidential employees, and supervisors as defined by the Act.
"
10671,The American National Red Cross,08-RC-275374,Cleveland,OH,2021-04-09,"Region 08, Cleveland, Ohio",Closed,07/16/2021,Dismissal Non-adjusted,,7.0,,"All Volunteer Engagement Representatives I and II managed through Blood Services Northern Ohio Region of the American Red Cross to be included in the Petitioner's existing unit consisting of the Employer's regular full-time and regular  part-time Donor Recruitment Department Account Managers, as certified in NLRB Case Nos. 8-RC-153338, but excluding any Volunteer Engagement Representatives managed by other Regions of the American Red Cross."
10673,"David Bruce Auto Center, Inc. d/b/a David Bruce Toyota",25-RC-275449,Bourbonnais,IL,2021-04-09,"Region 25, Indianapolis, Indiana",Closed,06/17/2021,Certific. of Representative,8.0,9.0,"District Lodge 8, International Association of Machinists and Aerospace Workers, AFL-CIO","Included: All full-time and regular part-time technicians including, Journeyman Technicians, Apprentice Technicians, and Lube Rack
Technicians who are employed at the employers 555 William R Latham Senior Dr. facility

Excluded: All other employees, including Sales Employees, Parts Employees, Porters, Office Clerical Employees, Professional Employees,
Guards and Supervisors, as defined by the Act."
10674,"Southern Anesthesia Associates, LLC",12-RC-275393,Ponce,PR,2021-04-09,"Region 12, Tampa, Florida",Closed,06/16/2021,Certific. of Representative,10.0,10.0,Unión General de Trabajadores,"INCLUDED:  Anesthesia nurses
EXCLUDED:  All other employees, guards and supervisors as defined by the Act."
10675,"Prospect CCMC, LLC, d/b/a Taylor Hospital",04-RC-275394,Ridley Park,PA,2021-04-09,"Region 04, Philadelphia, Pennsylvania",Closed,06/28/2021,Certific. of Representative,57.0,75.0,Pennsylvania Association of Staff Nurses and Allied Professionals (PASNAP),
10676,Roman Entertainment Corporation of Indiana d/b/a Caesars Southern Indiana,25-RC-275395,Elizabeth,IN,2021-04-09,"Region 25, Indianapolis, Indiana",Closed,06/22/2021,Certific. of Representative,8.0,5.0,"General Drivers, Warehousemen and Helpers, Local Union No. 89","Included: all Caesars Loyalty Rewards Representatives
Excluded: all office, clerical, administrative, Leads, and supervisors as defined by the act"
10677,"Delaware Resource Group of Oklahoma, Inc.",28-RC-275459,Albuquerque,NM,2021-04-09,"Region 28, Phoenix, Arizona",Closed,04/22/2021,Withdrawal Non-adjusted,,5.0,,"Included: All Full Time and Regular Part Time Simulator Technicians, Electronic Technicians I, II's & III's, Electronic Technician Leads employed by the employer at Kirkland AFB 2000 Wyoming Blvd. 482 Albuquerque, NM 87123 

Excluded: Managers, Supervisors, Clerical Workers, and all other employees including professional employees, managerial employees, guards, supervisors, and all other employees as defined by the Act."
10680,Consolidated Bus Transit Inc.,29-RC-275347,Brooklyn,NY,2021-04-08,"Region 29, Brooklyn, New York",Closed,07/27/2021,Certific. of Representative,382.0,360.0,Amalgamated Transit Workers Local 854,"Included: drivers, matrons and mechanics Excluded: management, security guards, officers"
10681,"Paul Terra and Sons, LLC, d/b/a Terra Electric",04-RC-275237,Broomall,PA,2021-04-08,"Region 04, Philadelphia, Pennsylvania",Closed,05/17/2021,Certific. of Representative,24.0,18.0,"International Brotherhood of Electrical Workers, Local Union No. 98","Included: All full time and regular part time electricians, electrician helpers, and apprentices employed by the Employer.

Excluded: All other employees, delivery drivers, clerical employees, guards and supervisors as defined in the Act."
10682,"Beyond Hello IL, LLC",14-RC-275291,East Saint Louis,IL,2021-04-08,"Region 14, Saint Louis, Missouri",Closed,07/16/2021,Certification of Results,58.0,40.0,Local 881 United Food & Commercial Workers,"Included: All full-time and regular part-time customer consultants, senior customer consultants, and shift supervisors.  Excluded:  Store managers, office clerical employees, professional employees, guards, and supervisors as defined by the Act."
10683,"Titan Health, LLC d/b/a Tweed Leaf",27-RC-275288,Denver,CO,2021-04-08,"Region 27, Denver, Colorado",Closed,07/02/2021,Withdrawal Non-adjusted,,31.0,,"Included: All full-time and regular part-time employees at the facility located at 5959 E. 39th Avenue in Denver, Colorado. Excluded: Supervisors, security, confidential, and all temporary employees as defined in the Act."
10684,Title Fight,18-RC-275299,Des Moines,IA,2021-04-08,"Region 18, Minneapolis, Minnesota",Closed,04/16/2021,Withdrawal Non-adjusted,,2.0,,"Included:
Creative
Excluded:
Owner"
10685,GI Industries dba Waste Management,31-RC-275296,Simi Valley,CA,2021-04-08,"Region 31, Los Angeles, California",Closed,06/08/2021,Certific. of Representative,189.0,186.0,Teamsters Local Union No. 186,"Included: All full-time and part-time residential drivers, commercial drivers, roll-off drivers, rent-a-bin drivers, valet drivers, lift-gate/bulk drivers, heavy equipment operators, relief drivers, helpers,
scout drivers, maintenance department employees, mechanics, diesel technicians, preventive technicians, welders, painters, and general laborers. 

Excluded: All office, clerical, and administrative employees, and all guards, managers, and supervisors as defined in the Act."
10686,"Centerline Logistics Corporation, Olympic Tug & Barge, Inc., and Leo Marine Services, Inc., a single employer",21-RC-275324,Long Beach,CA,2021-04-08,"Region 21, Los Angeles, California",Closed,09/28/2022,Certific. of Representative,45.0,25.0,"International Organization of Masters, Mates & Pilots, AFL-CIO","Included: Chief Engineer/Deckhand, Licensed Engineer/Deckhand, Engineer Deckhand, Deckhand I, Deckhand II, Entry Level Deckhand and Barge Deckhand

Excluded: Guards, Statutory Supervisors, Managers, Tankermen and Clerical employees"
10687,Cushman & Wakefield,13-RC-275240,Downers Grove,IL,2021-04-07,"Region 13, Chicago, Illinois",Closed,04/15/2021,Withdrawal Non-adjusted,,2.0,,"Included:
All full-time and regular part-time skilled maintenance workers working for Cushman 8 Wakefield
on the 3050 Highland Parkway in Downers Grove

Excluded:
Office clerical, professional employees, managers, guards and supervisors as defined by The Act"
10689,"Healthcare Services Group, Inc.",01-RC-275287,Naugatuck,CT,2021-04-07,"Region 01, Boston, Massachusetts",Closed,05/25/2021,Certific. of Representative,21.0,20.0,"NEW ENGLAND HEALTH CARE EMPLOYEES UNION, DISTRICT 1199, SEIU","Included: All fulltime, regular part time & per diem Housekeepers, Cooks, Dietary Aides and Laundry Aides 
Excluded: AII other employees, supervisors and managers as defined by the Act"
10690,"Centerline Logistics Corporation, Olympic Tug & Barge, Inc., and Leo Marine Services, Inc., a single employer",32-RC-275310,Alameda,CA,2021-04-07,"Region 32, Oakland, California",Closed,09/28/2022,Certific. of Representative,26.0,27.0,"Inlandboatmen's Union of the Pacific, International Longshore and Warehouse Union","Included: All full-time and regular part-time employees, including all mates, junior mates, tankermen, chief engineers/deckhands, licensed engineers/deckhands, engineer deckhands, deckhands I, deckhands II, entry level deckhands, and barge deckhands in the San Francisco Bay Area region based at 321 A Avenue, Alameda, CA 94501.

Excluded: Managers, guards, supervisors as defined by the Act, confidential employees, office clerical employees, irregular part-time employees, and temporary employees.
"
10691,Northstar Industries Inc,29-RC-275164,Wantagh,NY,2021-04-06,"Region 29, Brooklyn, New York",Closed,08/25/2021,Certific. of Representative,5.0,4.0,Amalgamated Local 854,"Included: All truck drivers;
Excluded: All managers, officers, and supervisors as defined in the Act.
"
10692,"Pride Industries, Inc. and Solution One Industries, Inc., as joint employers",04-RC-275174,Fort Dix,NJ,2021-04-06,"Region 04, Philadelphia, Pennsylvania",Closed,06/21/2021,Certific. of Representative,107.0,100.0,"United Service Workers Union, IUJAT, Local 1212","Included: See attachment. Excluded: All other employees, supervisors and guards as defined in the Act."
10694,Association House of Chicago,13-RC-275196,Chicago,IL,2021-04-06,"Region 13, Chicago, Illinois",Closed,06/07/2021,Certific. of Representative,13.0,15.0,"Chicago Teachers Union, Local 1, AFT/IFT, AFL-CIO","Included:  Teachers, Office staff, Aides, and Counselors

Excluded:  managerial and confidential employees, guards and supervisors as defined in the Act."
10696,Schervier Pavilion,02-RC-275194,Hawthorne,NY,2021-04-06,"Region 02, New York, New York",Closed,07/02/2021,Certific. of Representative,86.0,90.0,1199SEIU United Healthcare Workers East,"Included: 
All full-time and regular part-time, including per diem*, non-professional employees, including LPNs
(Per Diem is defined as employees who worked an average of four or more hours per week for the thirteen week period immediately preceding the payroll eligibility date.)

Excluded:
All other employees, guards, and supervisors as defined in the Act. 
"
10697,The Children's Institute of Pittsburgh,06-RC-275204,Pittsburgh,PA,2021-04-06,"Region 06, Pittsburgh, Pennsylvania",Closed,06/03/2021,Certific. of Representative,127.0,129.0,"AFT Pennsylvania, affiliated with the American Federation of Teachers",
10699,"Commercial Facilities Management, Inc.",25-RC-275107,Fort Wayne,IN,2021-04-05,"Region 25, Indianapolis, Indiana",Closed,06/14/2021,Certific. of Representative,2.0,2.0,"International Union of Operating Engineers, Local 399","Included:
All full-time skilled maintenance workers, working for Commercial Facilities Management, Inc at 1300 S Harrison St, Fort Wayne, IN 46802
Excluded: 
Office, clerical, professional employees, managers, guards and supervisors as defined by The Act"
10700,"SAK Builders, Inc.",19-RC-275146,Seattle,WA,2021-04-05,"Region 19, Seattle, Washington",Closed,06/11/2021,Certific. of Representative,46.0,33.0,"SAK Builders, Inc.","Included:  Operative Plasterers and Cement Masons Local 528 members.

Excluded:  All other SAK Builders employees."
10702,Suiza Dairy Corporation,12-RC-275147,Aguadilla,PR,2021-04-05,"Region 12, Tampa, Florida",Closed,06/22/2021,Certific. of Representative,8.0,8.0,Central General De Trabajadores,"Included: All regular full-time and part-time laboratory technicians employed by the Employer at its place of business in Aguadilla  (24-RC-008707)

Excluded: all others employees as defined"
10703,Suiza Dairy Corporation,12-RC-275136,Aguadilla,PR,2021-04-05,"Region 12, Tampa, Florida",Closed,06/22/2021,Certific. of Representative,131.0,8.0,Central General De Trabajadores,"INCLUDED:  All regular full time and part time production employees employed by the Employer and all other employees as defined in RC-7942.
EXCLUDED:  All other employees excluded by 24-RC-7942."
10704,"Ceco Concrete Construction, L.L.C.",19-RC-275148,Seattle,WA,2021-04-05,"Region 19, Seattle, Washington",Closed,06/08/2021,Certific. of Representative,17.0,10.0,Operative Plasterers and Cement Masons Local 528 affiliated with Operative Plasterers and Cement Masons International Association,"Included: All full time and regular part time Cement Mason Journeyman and Apprentices employed by the employer. Clallum, Cowlitz, Grays Harbor, Island, Jefferson, King, Kitsap, Lewis, Mason, Pacific, Pierce, San Juan, Skagit, Snohomish, Thurston, Wahkiakum and Whatcom Counties. Excluded: All other employees, (including those represented by other Unions.) Guards and Supervisors."
10705,"Brock & Company, Inc.",01-RC-275171,Farmington,CT,2021-04-05,"Region 01, Boston, Massachusetts",Closed,06/08/2021,Certific. of Representative,18.0,18.0,"UNITED FOOD AND COMMERCIAL WORKERS UNION, LOCAL 371","Included: All full and regular part time food service workers 
Excluded: All office clerical and supervisors as defined in the Act
"
10706,"Safeway, Inc.",19-RC-275218,Seaside,OR,2021-04-05,"Region 19, Seattle, Washington",Closed,06/15/2021,Certific. of Representative,6.0,5.0,"Bakery, Confectionery, Tobacco Workers and Grain Millers Union, Local 114, AFL-CIO, CLC","Included: All Production Bakers, Utility Bakers, Cake Decorators. Excluded: Bakery Sales."
10707,"Island Creek Associates, LLC",32-RC-275157,Lemoore,CA,2021-04-05,"Region 32, Oakland, California",Closed,06/17/2021,Certific. of Representative,24.0,17.0,"INTERNATIONAL ASSOCIATION OF MACHINISTS AND AEROSPACE WORKERS, DISTRICT LODGE 725, AFL-CIO","Included: All full-time and regular part-time General Clerks, technical order
librarians, technical order library clerks, and travel clerks working at NAS
Lemoore at VFA-122 in Hanger 1, 210 Reeves Blvd., Lemoore, CA 93245.

Excluded: All managers, guards and supervisors as defined by the Act."
10708,Cascade Public Media,19-RC-275078,Seattle,WA,2021-04-02,"Region 19, Seattle, Washington",Closed,06/10/2021,Dismissal Non-adjusted,,2.0,,"Included: 

All Agile Project Managers and Front End Developers. NOTE: Petitioner seeks an ""Armour Globe"" election to place these newly-represented employees within the existing Petitioner-represented bargaining unit.

Excluded: 

All other employees, and guards and supervisors as defined in the Act."
10709,"Campbell Certified, Inc.",21-RC-275111,Oceanside,CA,2021-04-02,"Region 21, Los Angeles, California",Closed,05/24/2021,Certific. of Representative,16.0,11.0,District Council of Iron Workers of the State of California and Vicinity,"Included:  All full-time and regular part-time field ironworkers.

Excluded:  All managers, guards and supervisors as defined by the Act."
10710,Dignity Community Care and its subsidiary Dignity Health Medical Foundation d/b/a Dignity Health Medical Group- North State,20-RC-275075,Redding,CA,2021-04-02,"Region 20, San Francisco, California",Closed,06/02/2021,Certification of Results,6.0,6.0,SEIU United Healthcare Workers-West,"Included: All full-time and regular part-time Medical Assistants, Medical Office
Receptionist, and Surgery schedulers.
Excluded: All managers, guards and supervisors as defined by the Act."
10711,"Bio-Medical Application of California, Inc. and Liberty Dialysis Hawaii, LLC",20-RC-275074,Waimea,HI,2021-04-02,"Region 20, San Francisco, California",Closed,04/21/2021,Withdrawal Non-adjusted,,3.0,,"INCLUDED: 
Registered Nurses employed by the Employer at the Liberty Dialysis North Hawaii dialysis center (Armour-Globe)


EXCLUDED:
Confidential employees, managers, guards, and supervisors as defined by the Act"
10712,Nova Technologies,01-RC-275103,North Kingstown,RI,2021-04-02,"Region 01, Boston, Massachusetts",Closed,04/16/2021,Withdrawal Non-adjusted,,2.0,,Included: Simulator Instructors. Excluded: All others.
10713,Crozer Chester Medical Center,04-RC-275021,Chester,PA,2021-04-01,"Region 04, Philadelphia, Pennsylvania",Closed,04/13/2021,Withdrawal Non-adjusted,,3.0,,"Included: All full-time and regular part-time cardiac ultrasound technicians employed by the Employer at its Chester, Pennsylvania facility.  The Petitioner is seeking a self-determination election to include the petitioned for employees within the existing unit as per the attached. Excluded: See attachment."
10714,Treat America Food Services d/b/a Company Kitchen,14-RC-275014,Lenexa,KS,2021-04-01,"Region 14, Saint Louis, Missouri",Closed,07/02/2021,Certific. of Representative,16.0,14.0,"Teamsters Local Union No. 838, affiliated with the International Brotherhood of Teamsters","Included:  All full-time Merchandiser Route Drivers employed out of the Company's Lenexa, Kansas location.  Excluded:  All temporary employees, warehouse employees, office/clerical employees, dispatchers, managerial employees, professional employees, guards and supervisors as defined in the Act, and all other employees."
10715,"Ingleside Presbyterian Retirement Community, Inc. d/b/a Ingleside at Rock Creek",05-RC-275018,Washington,DC,2021-04-01,"Region 05, Baltimore, Maryland",Closed,06/02/2021,Certific. of Representative,7.0,10.0,1199 SEIU,"Included:  All full-time, part-time and per diem RNs.

Excluded:  All other employees, guards and supervisors as defined in the Act.
"
10716,"Ingleside Presbyterian Retirement Community, Inc. d/b/a Ingleside at Rock Creek",05-RC-275017,Washington,DC,2021-04-01,"Region 05, Baltimore, Maryland",Closed,06/02/2021,Certific. of Representative,14.0,13.0,1199 SEIU,"Included:  All Full time, regular Part time, and Per diem LPNs at Ingleside at Rock Creek as a residual title to the existing unit of non-professionals currently represented by 1199 SEIU United HealthCare Workers East. 

Excluded:  All other employees, guards, and supervisors as defined by the Act."
10718,Brown University,01-RC-274917,Providence,RI,2021-03-31,"Region 01, Boston, Massachusetts",Closed,05/28/2021,Certific. of Representative,12.0,12.0,International Brotherhood of Police Officers,"Included:  All Brown University Police Sergeants.  Excluded:  Exclusive of all other employees, building guards, public safety officers, security officers, campus building guards, campus police officers and communication control officers, office clerical employees and supervisors as defined under the Act."
10719,Concrete Company of the Ozarks,14-RC-274968,Springfield,MO,2021-03-31,"Region 14, Saint Louis, Missouri",Closed,07/19/2021,Certific. of Representative,8.0,9.0,"Teamsters Local Union No. 245, affiliated with the International Brotherhood of Teamsters","Included:  all full-time and regular part-time hourly paid drivers at Employer's facility at 3612 W. Nicholas St., Springfield, Missouri  65803.  Excluded:  All temporary employees, office/clerical employees, dispatchers, salespersons, managerial employees, professional employees, guards and supervisors as defined in the Act."
10720,"M & J Bus, Inc.",01-RC-274895,Salem,CT,2021-03-31,"Region 01, Boston, Massachusetts",Closed,05/04/2021,Withdrawal Non-adjusted,,8.0,,"Included: All full-time and regular part-time bus drivers.
Excluded: All other employees,  office clerical employees, guards, professional employees, and supervisors as defined in the Act."
