10178,"Quaker Houghton PA, Inc.",07-RC-280298,Detroit,MI,2021-07-22,"Region 07, Detroit, Michigan",Closed,10/07/2021,Certific. of Representative,29.0,32.0,"International Union, United Automobile, Aerospace and Agricultural Implement Workers of America (UAW), AFL-CIO","Included:  All full time, part time and supplemental production and maintenance employees.

Excluded:  All other employees; office, clerical, guards and supervisors as defined in the Act."
10179,Paragon Systems Inc,06-RC-280312,Pittsburgh,PA,2021-07-22,"Region 06, Pittsburgh, Pennsylvania",Closed,09/24/2021,Certific. of Representative,65.0,70.0,"Paragon Protective Service Officers National Union PSONU, United Federation LEOS-PBA","Included: All full-time and regular part-time Security Officers performing guard duties as defined in section 9(b)(3) of the National Labor Relations Act, employed by Paragon Systems Inc under Employer’s Contract No. 70RFP318DE3000001 with the Department of Homeland Security, Federal Protective Service. 

Excluded: All office clerical employees, professional employees and supervisors as defined by the Act."
10180,Millwood Incorporated,03-RC-280193,Rochester,NY,2021-07-21,"Region 03, Buffalo, New York",Closed,08/09/2021,Withdrawal Non-adjusted,,26.0,,"All full-time & regular part-time production and maintenance workers.
Excluded:  All clerical, temporary employees, managers, guards & supervisors as defined by the Act."
10181,"KR Contracting, Inc.",05-RC-280227,Sterling,VA,2021-07-21,"Region 05, Baltimore, Maryland",Closed,07/26/2021,Withdrawal Non-adjusted,,25.0,,"Included: 
All full time and regular part time security officers employed by the employer  
Excluded: 
All officer clerical employees, professional employees, lieutenants, and captain"
10182,Volunteers of Legal Service,02-RC-280217,New York,NY,2021-07-21,"Region 02, New York, New York",Closed,08/02/2021,Withdrawal Non-adjusted,,11.0,,"Included:
All full-time and regular part-time employees employed by the Employer including: staff attorney, law graduate, legal assistant, fellow, data, impact and community outreach manager, community advocate.

Excluded:
Office manager, directors, supervising attorney, AmeriCorps VISTA, interns, confidential employees, managerial employees and supervisors under the Act."
10183,"City Winery NY - Pier 57, LLC",02-RC-280252,New York,NY,2021-07-21,"Region 02, New York, New York",Closed,09/09/2021,Certification of Results,7.0,4.0,"Theatrical Protective Union, Local No. One, IATSE, AFL-CIO","Included:
All Production Technicians employed by the Employer.

Excluded:
All other employees, including all clerical workers, managers, guards, and supervisors as defined by the Act."
10184,Bull Moose Music,01-RC-280253,Salem,NH,2021-07-21,"Region 01, Boston, Massachusetts",Closed,09/22/2021,Certific. of Representative,21.0,25.0,United Food and Commercial Workers International Union,"Included: All Staff, Keyholders (Shift Supervisors), Head Clerks, Assistant Store Managers Excluded: Store Manager"
10185,"Garfield Beach CVS, LLC d/b/a CVS Pharmacy",21-RC-280239,Hemet,CA,2021-07-21,"Region 21, Los Angeles, California",Closed,10/05/2021,Certification of Results,11.0,8.0,,"Included:  All full-time and part-time retail clerks including cashiers, pharmacy technicians, pharmacy lead technicians, pharmacy service assosciates, pharmacy trainer, pharmacy trainees, PSA intern Pharmacists, under graduate Interns, shift supervisors, stock room supervisors in Xmas stores, photo lab technicians and photo lab supervisors, coordinators, Beauty Advisors, Inventory Specialists

Excluded:  Managers, store team leaders, assistant managers, nurse practitioners, physicians assistants, guards."
10186,"N & R of Poplar Bluff, Inc. dba Mark Twain Caring Center",14-RC-280156,Poplar Bluff,MO,2021-07-20,"Region 14, Saint Louis, Missouri",Closed,10/15/2021,Certific. of Representative,33.0,62.0,United Food and Commercial Workers Union Local 655,"Included: All nursing aides, housekeepers, laundry aides, dietary aides, transportation aides, med techs, and LPNs Excluded: All Registered Nurses, clerical and secretarial workers, bookkeepers, payroll, and all administrators"
10188,"Culpepper & Associates Security Services, Inc.",10-RC-280204,College Park,GA,2021-07-20,"Region 10, Atlanta, Georgia",Closed,09/30/2021,Certific. of Representative,13.0,14.0,"International Union, Security, Police and Fire Professionals of America (SPFPA)","Included: All Full-Time and Part-Time Armed and Unarmed Security Officers Performing Guard Duties As Defined In Section 9(b)(3) of The National Labor Relations Act, Employed by Culpepper Associates Security Services @ 1701 Columbia Ave, College Park, GA 30337

Excluded: All Office Clerical Employees, Professional Employees and Supervisors as Defined by the Act.
"
10189,Prep & Pastry Restaurant LLC,28-RC-280235,Tucson,AZ,2021-07-20,"Region 28, Phoenix, Arizona",Open,,,41.0,60.0,"United Food & Commercial Workers International Union, Local 99, AFL-CIO, CLC","INCLUDED:  All full-time and part-time kitchen employees, line cooks, prep cooks, dishwashers, bussers, servers, hostess, bakers and bartenders

EXCLUDED:  All other employees, office clerical employees, guards and supervisors as defined by the Act."
10190,Paragon Systems Inc,06-RC-280088,Harrisburg,PA,2021-07-19,"Region 06, Pittsburgh, Pennsylvania",Closed,09/13/2021,Certific. of Representative,47.0,40.0,"Paragon Protective Service Officers National Union PSONU, United Federation LEOS-PBA","Included: All full-time and regular part-time Security Officers, Guards, Security Police Officers, performing guard duties as defined in section 9(b)(3) of the National Labor Relations Act, employed by Paragon Systems Inc @ various locations throughout Central Pennsylvania. Excluded: All office clerical employees, professional employees and supervisors as defined by the Act."
10192,"Keurig Green Mountain, Inc.",05-RC-279973,Windsor,VA,2021-07-16,"Region 05, Baltimore, Maryland",Closed,10/08/2021,Certification of Results,387.0,400.0,,"Included: All full-time and regular part time production and maintenance employees, including plant clericals, and employees in the following departments: Coffee Processing, Production, Shipping and Receiving, and Facilities/Maintenance. 

Excluded: Office clericals, temporary employees, coaches, quality personnel, subcontracted employees, managers, drivers, guards, and supervisors as defined in the Act.
"
10194,"Chenega Infinity, LLC",05-RC-279989,Cheltenham,MD,2021-07-16,"Region 05, Baltimore, Maryland",Closed,10/06/2021,Certific. of Representative,28.0,28.0,"International Union, Security, Police and Fire Professionals of America (SPFPA)","Included:  All full-time and part-time armed and unarmed dispatchers, commercial vehicle inspectors and security officers performing guard duties as defined in section 9(b)(3) of the National Labor Relations Act, employed by Chenega Infinity, LLC at 9000 Commo Rd, Bldg 6, Cheltenham, MD 20623.  Excluded:  All office clerical employees, professional employees and supervisors as defined by the Act."
10195,Democracy Works,29-RC-280194,Brooklyn,NY,2021-07-16,"Region 29, Brooklyn, New York",Closed,08/11/2021,Withdrawal Non-adjusted,,36.0,,"Included: All full-time and regular part-time employees of the Employer.

Excluded: All guards, supervisors, and managerial employees as defined by the Act."
10196,Tower Isles Frozen Foods Ltd.,29-RC-280172,Brooklyn,NY,2021-07-16,"Region 29, Brooklyn, New York",Closed,10/29/2021,Certific. of Representative,68.0,60.0,"Local 621, United Construction Trades & Industrial Employees Union (U.C.T.I.E)","Included: All regular full-time and part-time production, maintenance, shipping and

Excluded: All other employees including office clerical employees, sales employees,"
10197,Lourdes Hospital LLC d/b/a Lourdes Counseling Center,19-RC-280018,Richland,WA,2021-07-16,"Region 19, Seattle, Washington",Closed,12/01/2021,Certification of Results,,31.0,,"Employees Included: The Petitioner seeks to add through a self-determination election all Perdiems in the Adult Psychiatric and Transitions inpatient units, including the following job titles: Care Coordinators, Case Managers,Court Coordinators, Health Unit Coordinators, Mental Health Aides, Mental Health Counselors, Mental Health Professionals, Registered Nurses, Secretaries, and Therapist employed by the employer at 1175 Carondelet Dr, Richland, WA 99354, to the existing bargaining unit. Employees Excluded: Excluding all guards, supervisors, managers and confidential employees as defined by the Act"
10198,"Paragon Systems, Inc.",05-RC-280042,Bethesda,MD,2021-07-16,"Region 05, Baltimore, Maryland",Closed,10/20/2021,Certific. of Representative,54.0,50.0,"International Union, Security, Police and Fire Professionals of America (SPFPA) and its Local 555 SPFPA","Included: All full-time and regular part-time Lieutenants and Lead Security Officers performing guard duties as defined in section 9(b)(3) of the National Labor Relations Act, employed by Paragon Systems Inc @ National Institute of Health at various facilities throughout the state of Maryland.  Excluded: All office clerical employees, professional employees and supervisors as defined by the Act."
10199,"WCL Chelsea, LLC",01-RC-280056,Chelsea,MA,2021-07-16,"Region 01, Boston, Massachusetts",Closed,09/28/2021,Withdrawal Adjusted,25.0,22.0,,"Included:  All full-time and regular part-time production employees employed by the employer at its facility in Chelsea, Massachusetts.  Excluded:  Office clerical employees, guards and supervisors as defined by the Act."
10200,"Hearst Communications, Inc. d/b/a The San Francisco Chronicle",20-RC-280026,San Francisco,CA,2021-07-16,"Region 20, San Francisco, California",Closed,10/18/2021,Certification of Results,5.0,6.0,"Pacific Media Workers Guild, TNG-CWA, Local 39521","Included:  Developers, including the newsroom developers and the data visualization developer, employed by the San Francisco Chronicle.

Excluded:  All other employees, managers, guards, and supervisors as defined in the Act."
10201,"Palace Entertainment, Kennywood",06-RC-280063,West Mifflin,PA,2021-07-16,"Region 06, Pittsburgh, Pennsylvania",Closed,08/13/2021,Withdrawal Non-adjusted,,18.0,,"Included:  All regular full and part time ride maintenance, ride inspectors, ride mechanics

Excluded:  Office Clerical Employees, Supervisors, Seasonal, Temporary and Probationary ride maintenance/ride inspectors/ride mechanics and Supervisors as defined by the Act.
"
10202,CVS Pharmacy,21-RC-280095,Rancho Santa Margarita,CA,2021-07-16,"Region 21, Los Angeles, California",Closed,09/24/2021,Certific. of Representative,20.0,19.0,"United Food and Commercial Workers, Local 324, International Union, AFL-CIO","Included Employees:  Full-Time and part-time beauty advisors, store associates, clerks, clerk Rx, PSA,
pharmacy technicians, pharmacy lead technicians, shift supervisors, y mas shift supervisors, photo lab
supervisor, coordinator, 15t,2nd,3rd, Ath
4 year of Rph school, pharmacy graduate, home health care clerks,
health care concierge.


Excluded Employees:  All managers (including store team leaders) assistant managers, operational
managers, pharmacists, nurse practitioners, physician assistants, guards, and all employees not situated
in CVS/pharmacy retail stores."
10204,CVS Pharmacy,21-RC-279941,Imperial Beach,CA,2021-07-15,"Region 21, Los Angeles, California",Closed,08/12/2021,Withdrawal Non-adjusted,,18.0,,"Included Employees- Full-Time and part-time beauty advisors, store associates, pharmacy technicians, pharmacy lead technicians, store associates Rx, pharmacy interns, shift supervisors, home health care clerks, and health care concierge. 

Excluded Employees. All managers (including store team leaders), assistant managers, nurse practitioners, physician assistants, guards, and all employees not situated in CVS/pharmacy retail stores.
"
10205,"Agregados Piedra Blanca, Inc.",12-RC-279939,Arecibo,PR,2021-07-15,"Region 12, Tampa, Florida",Closed,10/07/2021,Certific. of Representative,11.0,10.0,"Laborers' International Union of North America (LIUNA), District Council of Puerto Rico, AFL-CIO","Included:  All the Full Time and Regular Part Time Heavy Equipment Operators employed by the Employer at its Facilities.  Excluded:  All other employees, Office Clerical Employees, Professional Employees, Confidential Employees, Guards and Supervisors as defined by the Act."
10206,KEURIG DR PEPPER INC.,32-RC-280004,Fresno,CA,2021-07-15,"Region 32, Oakland, California",Closed,09/21/2021,Certification of Results,36.0,32.0,,"Included:  All full-time and regular part-time delivery drivers, forklift operators, and order selectors employed at the Employer's facility located in Fresno, California. 
Excluded: Alt office staff, maintenance mechanics, cold services employees, managers, guards, and supervisors, as defined by the Act."
10207,"ACSB Hospitality, LLC",04-RC-279839,Atlantic City,NJ,2021-07-14,"Region 04, Philadelphia, Pennsylvania",Closed,08/24/2021,Certific. of Representative,3.0,3.0,International Union of Painters and Allied Trades District Council 711,"Included: All full time and regular part time Apprentices, Painters and Wallcoverers employed by the Employer at its Hotel located at 801 Boardwalk, Atlantic City, NJ 08401Excluded: All Office Clerical employees, professional employees, guards and supervisors as defined by the act, and all other employees."
10208,"Safeway, Inc.",19-RC-279875,Portland,OR,2021-07-14,"Region 19, Seattle, Washington",Closed,09/13/2021,Certification of Results,2.0,4.0,,"Included: All production Bakers, Utility Bakers, and Cake Decorators. Excluded: All other employees."
10209,"Parks Garbage Services, Inc., d/b/a Hometown Disposal",06-RC-279869,Selinsgrove,PA,2021-07-14,"Region 06, Pittsburgh, Pennsylvania",Closed,08/27/2021,Certific. of Representative,21.0,22.0,Teamsters Local Union No. 764,"Included: All slingers, drivers and mechanics

Excluded: All other employees as defined by the Act."
10210,"Wynn MA, LLC d/b/a Encore Boston Harbor",01-RC-279858,Everett,MA,2021-07-14,"Region 01, Boston, Massachusetts",Closed,09/21/2021,Certific. of Representative,128.0,100.0,United Government Security Officers of America International Union and its Local 295,"Included;  All full-time and part-time armed and unarmed security officers employed by the employer.  Excluded:  clerical, managerial, salaried and supervisory personnel as defined by the Act."
10212,"Ryder Integrated Logistics, Inc.",04-RC-279910,Swedesboro,NJ,2021-07-14,"Region 04, Philadelphia, Pennsylvania",Closed,08/17/2021,Withdrawal Non-adjusted,,19.0,,"Included: All full-time and regular part-time drivers employed by the Employer at its 395 Pedricktown Road, Logan Township, New Jersey facility. Excluded: All other employees, office clerical employees, warehouse employees, guards and supervisors within the meaning of the Act."
10213,"Gannett Co., Inc. dba The Journal News/lohud.com, Times Herald Record/recordonline.com, and Poughkeepsie Journal/poughkeepsiejournal.com",02-RC-279924,White Plains,NY,2021-07-14,"Region 02, New York, New York",Closed,09/27/2021,Certific. of Representative,47.0,45.0,"NEWSGUILD OF NEW YORK, LOCAL 31003, COMMUNICATION WORKERS OF AMERICA, AFL-CIO","Included:
All full-time and regular part-time editorial employees of the Employer.

Excluded:
All other employees, including managers, guards and supervisors defined by the Act."
10214,CVS Pharmacy,21-RC-279955,Tustin,CA,2021-07-14,"Region 21, Los Angeles, California",Closed,08/20/2021,Certific. of Representative,14.0,13.0,"United Food and Commercial Workers, Local 324, AFL-CIO","Included Employees: Full-Time and part-time beauty advisors, store associates, clerks, clerk Rx, PSA, pharmacy technicians, pharmacy lead technicians, shift supervisors, y mas shift supervisors, photo lab supervisor, coordinator, 15\ 2nd, 3rd, 4th year of Rph school, pharmacy graduate, home health care clerks, health care concierge. 

Excluded Employees: All managers (including store team leaders) assistant managers, operational managers, pharmacists, nurse practitioners, physician assistants, guards, and all employees not situated in CVS/pharmacy retail stores."
10215,Carmeuse North America,10-RC-279779,Macon,GA,2021-07-13,"Region 10, Atlanta, Georgia",Closed,08/30/2021,Certific. of Representative,4.0,4.0,"United Steel, Paper and Forestry, Rubber, Manufacturing, Energy, Allied-Industrial and Service Workers International Union, AFL-CIO/CLC","Included: All full-time and regular part-time production and maintenance employees at the Employer's facility in Macon, GA; Excluded: All temporary employees, office clerical and professional employees, guards, and supervisors as defined in the Act"
10217,Specialty Foundry Products Inc.,10-RC-279837,Bessemer,AL,2021-07-13,"Region 10, Atlanta, Georgia",Closed,08/12/2021,Withdrawal Non-adjusted,,6.0,,"Included: All bricklayers and masons employed by the Employer. Excluded: General laborers, shop hands, mason tenders, supervisors, guards, and office staff as defined by the Act."
10218,"Centerra Group, LLC",15-RC-279794,Pensacola,FL,2021-07-13,"Region 15, New Orleans, Louisiana",Closed,10/01/2021,Certific. of Representative,41.0,38.0,United States Court Security Officers,"Included:  All full-time and shared position Court Security Officers (CSOs) and Lead Court Security
Officers (LCSOs) employed by the employer at the U.S. Courthouse, 100 N. Palafox St.,
Pensacola, FL and the U.S. Courthouse, 30 W. Government St., Panama City, FL

Excluded:  
All office clerical employees, professional employees, confidential employees and supervisors as
defined in the Act."
10219,"Security Watch, Inc",28-RC-279828,El Paso,TX,2021-07-13,"Region 28, Phoenix, Arizona",Closed,09/15/2021,Certific. of Representative,41.0,45.0,"International Union, Security, Police & Fire Professionals of America (SPFPA)","INCLUDED:  All full-time and part-time armed and unarmed security officers performing guard duties as defined in Section 9(b)(3) of the National Labor Relations Act, employed by Security Watch, Inc. at 9201 Gateway South Boulevard, El Paso, Texas 79924

EXCLUDED:  All office clerical employees, professional employees, and supervisors as defined by the Act."
10220,"First Student, Inc.",01-RC-279838,Plymouth,MA,2021-07-13,"Region 01, Boston, Massachusetts",Closed,09/20/2021,Withdrawal Non-adjusted,,85.0,,"All full time and part time bus drivers and spares drivers (two lots in Plymouth).
Excluded:
Managerial, office, rnechanics, guards and supervisors as defined by the Act."
10221,X-L Plastics Inc.,22-RC-279729,Clifton,NJ,2021-07-12,"Region 22, Newark, New Jersey",Closed,12/01/2021,Certific. of Representative,122.0,150.0,"Local 713, International Brotherhood of Trade Unions U.M.D., I.L.A., AFL-CIO","Included: All full time and part-time employees, laborers, general labor, operators, drivers, warehouse employees. Excluded: Office clerical, supervisors, and guards."
10223,Corpus Christi Regional Transportation,16-RC-279750,Corpus Christi,TX,2021-07-12,"Region 16, Fort Worth, Texas",Closed,07/28/2021,Withdrawal Non-adjusted,,104.0,,"Included: Transportation & Maintenance Workers.


Excluded: Management."
10224,"Wellpath, LLC",12-RC-279895,Florida City,FL,2021-07-12,"Region 12, Tampa, Florida",Closed,09/10/2021,Certific. of Representative,57.0,50.0,"International Union, Security, Police, and Fire Professionals of America (SPFPA) and its Local No.100","Included: All Full-Time and Part-Time Armed and Unarmed Custody Officers and Correctional Officers Performing Guard Duties as Defined in Section 9(b)(3) of the National Labor Relations Act, employed by Wellpath @ 18680 SW 376 St, Florida City, FL 33034.

Excluded: All Office Clerical Employees, Professional Employees and Supervisors as Defined by the Act.
"
10226,"Churchill Furniture, LLC, a/k/a Churchill Furniture Rental",22-RC-279649,Hawthorne,NJ,2021-07-09,"Region 22, Newark, New Jersey",Closed,11/30/2021,Certific. of Representative,64.0,42.0,LOCAL 17-18 UNITED PRODUCTION WORKERS UNION ,"Included: All full-time and regular part-time warehouse, production and maintenance workers, drivers and driver's helpers, including laundry workers,  upholsterers, forklift operators, shipping and receiving and repair workers employed at the Employer's Hawthorne, New Jersey facility.
Excluded: All other employees, office clerical, sales persons, guards and supervisors as defined in the Act."
10227,DFW Security Protective Force,13-RC-279684,Chicago,IL,2021-07-09,"Region 13, Chicago, Illinois",Closed,09/07/2021,Certific. of Representative,39.0,38.0,Illinois Council of Police Union on behalf of DFW Security Protective Force Employees,"Included:  FAA Security Guards assigned to the federal buildings in the state of Illinois.

Excluded:  All other employees of the Employer covered by the Act."
10228,Defenders of Wildlife,05-RC-279676,Washington,DC,2021-07-09,"Region 05, Baltimore, Maryland",Closed,09/22/2021,Certific. of Representative,100.0,96.0,"Office & Professional Employees International Union, Local 2, AFL-CIO","Included:  All full-time and regular part time employees employed by the Employer.

Excluded:  All confidential employees, managers, guards and supervisors as defined in the Act.
"
10229,Oxford University Press USA,02-RC-279675,Manhattan,NY,2021-07-09,"Region 02, New York, New York",Closed,09/27/2021,Certific. of Representative,129.0,160.0,"News Media Guild, TNG-CWA Local 31222",
10232,"Triple Canopy, Inc.",05-RC-279596,Washington,DC,2021-07-08,"Region 05, Baltimore, Maryland",Closed,12/15/2021,Certific. of Representative,66.0,70.0,United Career Professionals (UCP),"Included: All full-time and regular part-time security officers employed by the Employer at the EPA Building 

Excluded: Excluding office clerical employees, professional employees, managerial employees, Project Managers, Assistant Project Managers, and supervisors as defined by the Act"
10234,Middle Tennessee Electric Membership Corporation,10-RC-279607,Murfreesboro,TN,2021-07-08,"Region 10, Atlanta, Georgia",Closed,09/13/2021,Certific. of Representative,6.0,6.0,Middle Tennessee Electric Membership Corporation,"Included: This petition seeks a self-determination election for the presently unrepresented all full-time and regular part-time Fleet Maintenance Mechanics at the Middle Tennessee Electric Membership Corporation, Murfreesboro TN. facilities, and to be included in current unit in collective bargaining agreement dated the 26th day of August 2018 between the Middle Tennessee Electric Membership Corporation and Local Union No. 175 of the International Brotherhood of Electrical Workers. 

Excluded: All other employees, confidential employees, and guards and supervisors as defined by the act."
10235,ADC LTD NM,10-RC-279628,Hapeville,GA,2021-07-08,"Region 10, Atlanta, Georgia",Closed,09/09/2021,Certific. of Representative,9.0,8.0,United Government Security Officers of America and its Local 291,"Included:  All full-time and part-time armed and unarmed security officers employed by the Employer.

Excluded:  Clerical, managerial, salaried, and supervisory personnel as defined by the Act."
10236,"Northern Manor Multicare Center, Inc.",02-RC-279697,Nanuet,NY,2021-07-08,"Region 02, New York, New York",Closed,09/27/2021,Certification of Results,1.0,16.0,1199SEIU United Healthcare Workers East,"Included: All full-time, regular part-time* Speech Language Pathologists, Physical
Therapists, Physical Therapist Assistants (“PTAs”), Occupational Therapists, Certified
Occupational Therapist Assistants (“COTAs”), and Occupational Therapist Assistants
(“OTAs”) as a residual unit to the existing 1199-represented professional and technical
bargaining unit and all full-time, regular part-time* Rehab Aides as a residual unit to the
existing 1199-represented service and maintenance bargaining unit.
* Eligible employees are those who worked an average of 4 or more hours per week over the
preceding 13 week period.
Excluded: All other employees, guards and supervisors as defined by the Act.

"
10239,"Paragon Systems, Inc.",05-RC-279540,Washington,DC,2021-07-07,"Region 05, Baltimore, Maryland",Closed,07/26/2021,Withdrawal Non-adjusted,,300.0,,"Included:  All full-time and regular part-time security officers employed by the Employer at the National Institutes of Health (NIH).

Excluded:  All officer, clerical employees, professional employees, lieutenants and captain
"
10241,Big Green,27-RC-279630,Boulder,CO,2021-07-07,"Region 27, Denver, Colorado",Closed,07/29/2021,Withdrawal Non-adjusted,,14.0,,Includes: All employees as included. Excluded: Statutorily excluded individuals
10242,X-L Plastics,22-RC-279583,Clifton,NJ,2021-07-07,"Region 22, Newark, New Jersey",Closed,12/01/2021,Certific. of Representative,,120.0,"Local 713, International Brotherhood of Trade Unions U.M.D., I.L.A., AFL-CIO","INCLUDED: All full & part time employees, laborers, general labor, operations & warehouse employees

EXCLUDED:  All others, including, but not limited to, clerical, supervisors and lead personnel."
10243,"Brenntag Mid-South, Inc.",14-RC-279611,Saint Louis,MO,2021-07-07,"Region 14, Saint Louis, Missouri",Closed,09/17/2021,Certification of Results,20.0,21.0,International Brotherhood of Teamsters Local 618,"Included:  truck drivers, warehouse workers, forklift drivers, etc.  Excluded:  management/corporate employees or any other non-bargaining unit employees."
